taxonomy,uri,taxonomy.parent,type,description,summaryPPC038, /peoplepopulationandcommunity /householdcharacteristics /homeinternetandsocialmediausage,PPC037,Product Page,Home internet and social media usage,"Use of the internet and social media and how long we use it for. These data include the number of people who have used the internet, those who use the internet frequently and those who have never used the internet. Most of these statistics are broken down by age and gender."PPC039, /peoplepopulationandcommunity /housing,PPC001,Product Page,Housing,"Property price, private rent and household survey and census statistics, used by government and other organisations for the creation and fulfilment of housing policy in the UK."PPC040, /peoplepopulationandcommunity /leisureandtourism,PPC001,Product Page,Leisure and tourism,"Visits and visitors to the UK, the reasons for visiting and the amount of money they spent here. Also UK residents travelling abroad, their reasons for travel and the amount of money they spent. The statistics on UK residents travelling abroad are an informal indicator of living standards."PPC041, /peoplepopulationandcommunity /personalandhouseholdfinances,PPC001,Landing Page,Personal and household finances,"Income and earnings, spending and saving, and wealth and debt. These statistics help build a picture of how living standards and inequality have changed. "PPC042, /peoplepopulationandcommunity /personalandhouseholdfinances /debt,PPC041,Product Page,Debt,"Debt of UK households, broken down by financial debt and property debt."PPC043, /peoplepopulationandcommunity /personalandhouseholdfinances /expenditure,PPC041,Product Page,Expenditure,"Spending patterns of UK households, with findings taken from the Living Costs and Food Survey (LCF)."PPC044, /peoplepopulationandcommunity /personalandhouseholdfinances /incomeandwealth,PPC041,Product Page,Income and wealth,UK household income and wealth.PPC045, /peoplepopulationandcommunity /personalandhouseholdfinances /pensionssavingsandinvestments,PPC041,Product Page,"Pensions, savings and investments","State, private, occupational and workplace pensions, including pension trends that draws together data from other government departments and organisations.  "PPC046, /peoplepopulationandcommunity /populationandmigration,PPC001,Landing Page,Population and migration,"Size, age, gender and geographic distribution of the UK population, and changes in the UK population and the factors driving these changes. These statistics have a wide range of uses. Central government, local government and the health sector use them for planning, resource allocation and managing the economy. They are also used by people such as market researchers and academics."PPC047, /peoplepopulationandcommunity /populationandmigration /internationalmigration,PPC046,Product Page,International migration,"People moving into and out of the UK, long term migration, short term migration, and non-UK residents data providing a picture of those entering and leaving the UK, covering all lengths of stay. "PPC048, /peoplepopulationandcommunity /populationandmigration /migrationwithintheuk,PPC046,Product Page,Migration within the UK,"Residential moves between different geographic areas within the UK sourced from the NHS Patient Register, the NHS Central Register (NHSCR) and the Higher Education Statistics Agency (HESA). "PPC049, /peoplepopulationandcommunity /populationandmigration /populationestimates,PPC046,Product Page,Population estimates,"Annual population estimates for the UK and its constituent countries, the regions and counties of England, and local authorities and their equivalents. Estimates for lower and middle layer Super Output Areas, Westminster parliamentary constituencies, electoral wards and National Parks in England and Wales and clinical commissioning groups in England."PPC050, /peoplepopulationandcommunity /populationandmigration /populationprojections,PPC046,Product Page,Population projections,"Population projections provide an indication of the future size and age structure of the population based on mid-year population estimates and a set of assumptions of future fertility, mortality and migration. Available for the UK and its constituent countries as national population projections and for the regions, local authorities and clinical commissioning groups in England as subnational population projections. These projections are widely used for resource allocation and planning."PPC051, /peoplepopulationandcommunity /wellbeing,PPC001,Product Page,Well-being,"Societal and personal well-being in the UK looking beyond what we produce, to areas such as health, relationships, education and skills, what we do, where we live, our finances and the environment. This data comes from a variety of sources and much of the analysis is new."